{
  "status": "partial",
  "data": {
    "schemaVersion": "1.0",
    "knowledgeMode": "current",
    "evidence": {
      "id": "99999999-9999-4999-8999-999999999999",
      "tenantId": "tenant-demo",
      "incidentId": "55555555-5555-3555-8555-555555555555",
      "kind": "incident",
      "summary": "Fixture CPU problem; current human status OPEN; source recovered.",
      "observedAt": "2026-09-25T00:00:00Z",
      "availableAt": "2026-09-25T00:00:00Z",
      "expiresAt": "2026-09-26T00:00:00Z",
      "sourceRef": "/api/v1/ai/evidence/99999999-9999-4999-8999-999999999999",
      "trust": "untrusted_data"
    },
    "sessionId": "88888888-8888-4888-8888-888888888888",
    "incidentVersion": 1,
    "entityIds": [
      "11111111-1111-1111-1111-111111111111"
    ],
    "queryWindow": {
      "from": "2026-09-21T11:30:00Z",
      "to": "2026-09-21T12:30:00Z"
    },
    "dataModes": [
      "labeled-fixture"
    ],
    "policyVersion": "readonly-diagnosis-v1",
    "producerTool": "incident.get@2.0.0",
    "warnings": [
      "CURRENT_KNOWLEDGE_ONLY",
      "LOGS_NOT_CONNECTED",
      "CHANGES_NOT_CONNECTED"
    ],
    "data": {
      "title": "Fixture: CPU threshold exceeded",
      "status": "OPEN",
      "severity": 3,
      "version": 1,
      "problems": [
        {
          "sourceInstanceId": "zabbix-1",
          "sourceContract": "zabbix-7.0-event-v1",
          "dataMode": "labeled-fixture",
          "problemEventId": "30001",
          "title": "Fixture: CPU threshold exceeded",
          "state": "RECOVERED",
          "severity": 3,
          "occurredAt": "2026-09-21T12:00:00Z",
          "observedAt": "2026-09-25T00:00:00Z",
          "lastReceivedAt": "2026-09-25T00:00:00Z",
          "suppressed": false,
          "recoveryEventId": "30003",
          "recoveredAt": "2026-09-21T12:10:00Z",
          "overlapsWindow": true
        }
      ]
    }
  },
  "evidenceRefs": [
    "99999999-9999-4999-8999-999999999999"
  ],
  "warnings": [
    "CURRENT_KNOWLEDGE_ONLY",
    "LOGS_NOT_CONNECTED",
    "CHANGES_NOT_CONNECTED"
  ],
  "truncated": false
}
